body|title
"













En este tiempo tan desafiante que vivimos es indiscutible que el comercio electrónico se transformó en una herramienta clave para que las pequeñas y medianas empresas generen ingresos, y para que los compradores tengan acceso ágil, simple y accesible a una mayor cantidad de productos y servicios. Esta industria rompió barreras económicas, sociales y geográficas y acercó la innovación a gente como nunca antes.
En este contexto nació SeSocio.com, el marketplace de inversiones que se expandió rápidamente en Latinoamérica. Hoy cuenta con más de 2.200.000 operaciones realizadas, $395.083 millones operados, en los últimos 3 años, financiaron más de 240 proyectos en latinoamérica. En su camino de innovación permanente, SeSocio consolidó el crecimiento de su propia criptomoneda, la InveCoin, generando más de USD 9 millones en ventas durantes su proceso de emisión a fines de 2019 y que hoy cuenta con una capitalización superior a los USD 90 millones.
En Colombia, la plataforma lidera el espacio del mundo cripto, acercándole a los usuarios las mejores propuestas en criptomonedas como Bitcoin, Ethereum, Dai, Thron, InveCoin, Neo, Binance Coin, IOTA,Theter, Dash, todo de forma 100% online, de principio a fin, sin intermediacion, en forma confiable y transparente para ambas partes, y sin barreras de ingreso.
Ahora, la plataforma ingresa en una nueva etapa del futuro de las finanzas descentralizadas, que ellos denominan la “segunda revolución de las inversiones”, y que comienza con el prendido de la fase de liquidez del protocolo de liquidez continua CLPS- por sus siglas en inglés Continuous Liquidity Protocol System-  que se pondrá en marcha con el “Glowing” el 31 de mayo.

 
 

Los usuarios pueden ingresar al CLPS invirtiendo en USD, pesos, Inves o incluso  tokens de otros proyectos y recibirán a cambio Liqui Tokens -que son los tokens o participaciones del Protocolo de Liquidez Continua con cotización propia dentro de la plataforma.
El  CLPS  permitirá que todos los proyectos de la plataforma e incluso la criptomoneneda Inve Coin cuenten con liquidez continua, permitiéndole a los usuarios operar las 24 horas del día sin la necesidad de encontrar una contraparte para realizar operaciones de compra o venta.
Cada inversor de Liqui Token participará de una parte de las comisiones por las operaciones realizadas en la plataforma de trading y tendrá el derecho a participar en la toma de algunas decisiones sobre el funcionamiento del protocolo. Es importante destacar que hasta el 31.05 inclusive se puede invertir en Liqui Token con precio de descuento por pre-venta y así ser parte de este proyecto que revoluciona el futuro de la finanzas descentralizadas.
“Estos son momentos donde cualquiera puede experimentar el real impacto que la tecnología tiene para potenciar el desarrollo a la vez que le permite participar a todo el mundo. Esa es nuestra misión. Llevamos la innovación en nuestro ADN y por eso queremos ser disruptivos para nuestra comunidad. Que cada miembro encuentre siempre en SeSocio.com la posibilidad de ser el dueño del crecimiento de sus activos en forma simple, segura, transparente y justa” explicó Guido Quaranta, CEO de SeSocio.com”.
El desarrollo de este protocolo para implementar las finanzas descentralizadas, es un hito fundamental en la corta historia de SeSocio, porque escribe un nuevo capítulo en el mundo de las inversiones de habla hispana.
9211302020-05-26T09:00:00-05:00article2020-05-26T09:00:02-05:00nefernandez_262362noneRedacción EspecialesActualidadCuenta regresiva para el Glowing, una oportunidad única para los inversores de América Latina9582528347

"|Cuenta regresiva para el Glowing, una oportunidad única para los inversores de América Latina
