body,title
"
El día de hoy, estamos enfrentando una situación complicada a nivel mundial. Esta emergencia sanitaria ha generado diversas redes de ayuda en favor de la economía, la salud, entre otras. Mazda, se ha unido a este principio de apoyo.
Contribuir para la gente y la sociedad, es uno de las prioridades de Mazda, por lo que en esta época difícil, la empresa automotriz realiza cambio de aceite sin costo para los autos de personal del sector salud.
El apoyo de Mazda ante pandemia
Durante el mes de mayo, la compañía ofrece apoyo para realizar cambio de aceite sin costo los autos de los doctores, paramédicos, enfermeras y cualquier empleado del sector salud que hoy se encuentre en las líneas del frente en la lucha contra el COVID-19.

¿Cuáles son las bases para acceder a este apoyo?
Este beneficio se aplica a cualquier marca o modelo de auto, sólo que para ser acreedores a este tu auto no debe tener más de 60,000 kms recorridos.
Requisitos para cambio de aceite sin costo
•          El propietario del vehículo deberá ser quien directamente solicite este servicio
•          El propietario deberá mostrar una identificación que lo acredite como empleado del sector salud (identificación, carta de hospital, etc.)
•          Todos los servicios de mantenimiento del vehículo deberán haber sido efectuados oportunamente en los distribuidores de su marca correspondiente (mostrar póliza de garantía sellada o cualquier otro comprobante que muestre que los servicios fueron efectuados en tiempo y forma), previo a la confirmación de este servicio de cortesía
•          El kilometraje máximo del vehículo no deberá exceder los 60,000 kilómetros
•          El programa no aplica para las personas morales
Así que si eres parte de este sector y reúnes las bases, tendrás a tu disposición esta ayuda durante este mes, en toda la República Mexicana.
Compromiso Mazda
La compañía automotriz, ha lanzado esta iniciativa, obedeciendo a su principio de contribuir a la gente y la sociedad. Y hoy a través de estas acciones reiteran su compromiso de robustecer su cooperación en estos momentos, sumando acciones que favorezcan a la rutina de los héroes que luchan a diario para mantenernos a salvo.
Puedes acudir a sus centros de servicios. Para saber más sobre Mazda puedes visitar https://www.mazda.mx/
 
","Ante contingencia por Covid-19, Mazda Ofrecerá Cambios De Aceite Sin Costo"
